{
  "schema": "motionjson.web_asset_manifest.v0.1",
  "type": "web_motion_asset",
  "assetId": "object_0",
  "label": "selected_object",
  "sourceSceneGraph": "../../scene_graph.json",
  "renderMode": "raster_alpha_sequence",
  "recommendedEmbedMode": "canvas_sprite_layer",
  "canvas": {
    "width": 640,
    "height": 360,
    "fps": 12.0,
    "frameCount": 48
  },
  "assets": {
    "poster": "../../objects/object_0/cutouts/cutout_000001.png",
    "spritesheet": {
      "path": "../../objects/object_0/spritesheet.webp",
      "width": 721,
      "height": 721,
      "columns": 7,
      "rows": 7,
      "cellWidth": 103,
      "cellHeight": 103,
      "frames": [
        {
          "x": 0,
          "y": 0,
          "w": 103,
          "h": 103
        },
        {
          "x": 103,
          "y": 0,
          "w": 102,
          "h": 103
        },
        {
          "x": 206,
          "y": 0,
          "w": 102,
          "h": 103
        },
        {
          "x": 309,
          "y": 0,
          "w": 100,
          "h": 102
        },
        {
          "x": 412,
          "y": 0,
          "w": 103,
          "h": 103
        },
        {
          "x": 515,
          "y": 0,
          "w": 102,
          "h": 102
        },
        {
          "x": 618,
          "y": 0,
          "w": 102,
          "h": 100
        },
        {
          "x": 0,
          "y": 103,
          "w": 103,
          "h": 103
        },
        {
          "x": 103,
          "y": 103,
          "w": 102,
          "h": 103
        },
        {
          "x": 206,
          "y": 103,
          "w": 102,
          "h": 103
        },
        {
          "x": 309,
          "y": 103,
          "w": 102,
          "h": 103
        },
        {
          "x": 412,
          "y": 103,
          "w": 102,
          "h": 103
        },
        {
          "x": 515,
          "y": 103,
          "w": 103,
          "h": 103
        },
        {
          "x": 618,
          "y": 103,
          "w": 103,
          "h": 103
        },
        {
          "x": 0,
          "y": 206,
          "w": 102,
          "h": 103
        },
        {
          "x": 103,
          "y": 206,
          "w": 103,
          "h": 103
        },
        {
          "x": 206,
          "y": 206,
          "w": 103,
          "h": 103
        },
        {
          "x": 309,
          "y": 206,
          "w": 103,
          "h": 103
        },
        {
          "x": 412,
          "y": 206,
          "w": 103,
          "h": 103
        },
        {
          "x": 515,
          "y": 206,
          "w": 103,
          "h": 103
        },
        {
          "x": 618,
          "y": 206,
          "w": 103,
          "h": 103
        },
        {
          "x": 0,
          "y": 309,
          "w": 103,
          "h": 103
        },
        {
          "x": 103,
          "y": 309,
          "w": 103,
          "h": 103
        },
        {
          "x": 206,
          "y": 309,
          "w": 103,
          "h": 103
        },
        {
          "x": 309,
          "y": 309,
          "w": 103,
          "h": 103
        },
        {
          "x": 412,
          "y": 309,
          "w": 103,
          "h": 103
        },
        {
          "x": 515,
          "y": 309,
          "w": 103,
          "h": 103
        },
        {
          "x": 618,
          "y": 309,
          "w": 103,
          "h": 101
        },
        {
          "x": 0,
          "y": 412,
          "w": 103,
          "h": 102
        },
        {
          "x": 103,
          "y": 412,
          "w": 103,
          "h": 103
        },
        {
          "x": 206,
          "y": 412,
          "w": 103,
          "h": 103
        },
        {
          "x": 309,
          "y": 412,
          "w": 102,
          "h": 103
        },
        {
          "x": 412,
          "y": 412,
          "w": 103,
          "h": 101
        },
        {
          "x": 515,
          "y": 412,
          "w": 103,
          "h": 103
        },
        {
          "x": 618,
          "y": 412,
          "w": 103,
          "h": 103
        },
        {
          "x": 0,
          "y": 515,
          "w": 103,
          "h": 103
        },
        {
          "x": 103,
          "y": 515,
          "w": 103,
          "h": 103
        },
        {
          "x": 206,
          "y": 515,
          "w": 101,
          "h": 101
        },
        {
          "x": 309,
          "y": 515,
          "w": 103,
          "h": 102
        },
        {
          "x": 412,
          "y": 515,
          "w": 103,
          "h": 103
        },
        {
          "x": 515,
          "y": 515,
          "w": 103,
          "h": 103
        },
        {
          "x": 618,
          "y": 515,
          "w": 103,
          "h": 103
        },
        {
          "x": 0,
          "y": 618,
          "w": 103,
          "h": 103
        },
        {
          "x": 103,
          "y": 618,
          "w": 103,
          "h": 102
        },
        {
          "x": 206,
          "y": 618,
          "w": 103,
          "h": 103
        },
        {
          "x": 309,
          "y": 618,
          "w": 103,
          "h": 103
        },
        {
          "x": 412,
          "y": 618,
          "w": 102,
          "h": 103
        },
        {
          "x": 515,
          "y": 618,
          "w": 103,
          "h": 101
        }
      ]
    },
    "sequence": [
      {
        "frame": 1,
        "t": 0.0,
        "asset": "../../objects/object_0/cutouts/cutout_000001.png",
        "x": 29,
        "y": 129,
        "width": 103,
        "height": 103,
        "anchor": [
          51.196,
          50.779
        ],
        "opacity": 1.0,
        "scale": 1.0,
        "rotation": 0.0,
        "visible": true,
        "sprite": {
          "x": 0,
          "y": 0,
          "w": 103,
          "h": 103
        }
      },
      {
        "frame": 2,
        "t": 0.083333,
        "asset": "../../objects/object_0/cutouts/cutout_000002.png",
        "x": 39,
        "y": 138,
        "width": 102,
        "height": 103,
        "anchor": [
          51.021,
          50.9
        ],
        "opacity": 1.0,
        "scale": 1.0,
        "rotation": 0.0,
        "visible": true,
        "sprite": {
          "x": 103,
          "y": 0,
          "w": 102,
          "h": 103
        }
      },
      {
        "frame": 3,
        "t": 0.166667,
        "asset": "../../objects/object_0/cutouts/cutout_000003.png",
        "x": 49,
        "y": 148,
        "width": 102,
        "height": 103,
        "anchor": [
          50.627,
          51.127
        ],
        "opacity": 1.0,
        "scale": 1.0,
        "rotation": 0.0,
        "visible": true,
        "sprite": {
          "x": 206,
          "y": 0,
          "w": 102,
          "h": 103
        }
      },
      {
        "frame": 4,
        "t": 0.25,
        "asset": "../../objects/object_0/cutouts/cutout_000004.png",
        "x": 60,
        "y": 157,
        "width": 100,
        "height": 102,
        "anchor": [
          50.173,
          51.079
        ],
        "opacity": 1.0,
        "scale": 1.0,
        "rotation": 0.0,
        "visible": true,
        "sprite": {
          "x": 309,
          "y": 0,
          "w": 100,
          "h": 102
        }
      },
      {
        "frame": 5,
        "t": 0.333333,
        "asset": "../../objects/object_0/cutouts/cutout_000005.png",
        "x": 69,
        "y": 164,
        "width": 103,
        "height": 103,
        "anchor": [
          50.784,
          50.729
        ],
        "opacity": 1.0,
        "scale": 1.0,
        "rotation": 0.0,
        "visible": true,
        "sprite": {
          "x": 412,
          "y": 0,
          "w": 103,
          "h": 103
        }
      },
      {
        "frame": 6,
        "t": 0.416667,
        "asset": "../../objects/object_0/cutouts/cutout_000006.png",
        "x": 79,
        "y": 172,
        "width": 102,
        "height": 102,
        "anchor": [
          51.168,
          49.903
        ],
        "opacity": 1.0,
        "scale": 1.0,
        "rotation": 0.0,
        "visible": true,
        "sprite": {
          "x": 515,
          "y": 0,
          "w": 102,
          "h": 102
        }
      },
      {
        "frame": 7,
        "t": 0.5,
        "asset": "../../objects/object_0/cutouts/cutout_000007.png",
        "x": 90,
        "y": 178,
        "width": 102,
        "height": 100,
        "anchor": [
          50.146,
          48.429
        ],
        "opacity": 1.0,
        "scale": 1.0,
        "rotation": 0.0,
        "visible": true,
        "sprite": {
          "x": 618,
          "y": 0,
          "w": 102,
          "h": 100
        }
      },
      {
        "frame": 8,
        "t": 0.583333,
        "asset": "../../objects/object_0/cutouts/cutout_000008.png",
        "x": 99,
        "y": 178,
        "width": 103,
        "height": 103,
        "anchor": [
          51.17,
          51.295
        ],
        "opacity": 1.0,
        "scale": 1.0,
        "rotation": 0.0,
        "visible": true,
        "sprite": {
          "x": 0,
          "y": 103,
          "w": 103,
          "h": 103
        }
      },
      {
        "frame": 9,
        "t": 0.666667,
        "asset": "../../objects/object_0/cutouts/cutout_000009.png",
        "x": 110,
        "y": 178,
        "width": 102,
        "height": 103,
        "anchor": [
          50.214,
          51.123
        ],
        "opacity": 1.0,
        "scale": 1.0,
        "rotation": 0.0,
        "visible": true,
        "sprite": {
          "x": 103,
          "y": 103,
          "w": 102,
          "h": 103
        }
      },
      {
        "frame": 10,
        "t": 0.75,
        "asset": "../../objects/object_0/cutouts/cutout_000010.png",
        "x": 120,
        "y": 177,
        "width": 102,
        "height": 103,
        "anchor": [
          50.332,